{"anatomyDataHash":"44136fa355b3678a1146ad16f7e8649e94fb4fc21fe77e8310c060f61caaff8a","assemblies":[{"allowedMotionFields":[],"baseTransformBits":[1065353216,0,0,0,0,1065353216,0,0,0,0,1065353216,0,0,0,0,1065353216],"joint":{"status":"static_fixture"},"key":"vehicle/0:body/2:turret_0/1:gun_0/1:barrel/visual:14","parent":null,"pivot":[0,0,0]}],"audits":{"activity":"pending_semantic_state","ambiguousBindings":0,"boundaryEdges":8,"certification":"audit_pending_diagnostic","declaredOpenBoundaries":null,"degenerateCount":0,"missingBindings":160,"nonmanifoldEdges":0,"renderPositionDifferences":0,"shaderDeformation":"not_declared","topologyPending":true,"triangleCoverage":160,"unclassifiedPhysicalTriangles":160},"bindings":[],"buildHash":"8096370ebda5ceef5ad87ca1afe29f48e79ee974bea891ea985d68261f233757","buildRecipeHash":"e7745633929b5f8577a78862259bb5fb54ecb6bdaf8aab504adfc1b6ac9a726a","endianness":"LE","format":"THMESH1","generator":{"revision":"fixture","sha256":"c1312a6c9c3623ce9fb78d5530755e1737591678163ea8f401124796ca567cce"},"manifestHash":"6cf5950f314f8f6821a4a775949fd794de8ea06ef0a333773214ef78d6e8532a","meshInstances":[{"activityPolicy":"audit_pending_state; visibility_ignored","assemblyKey":"vehicle/0:body/2:turret_0/1:gun_0/1:barrel/visual:14","instanceBits":[1065353216,0,0,0,0,1065353216,0,0,0,0,1065353216,0,0,0,0,1065353216],"key":"instance:vehicle/0:body/2:turret_0/1:gun_0/1:barrel/visual:14:0","materialFeature":{"capturedInstanceOrdinal":0,"source":null,"status":"audit_pending"},"meshKey":"mesh:vehicle/0:body/2:turret_0/1:gun_0/1:barrel/visual:14","sourceKey":"generated:c1312a6c9c3623ce9fb78d5530755e1737591678163ea8f401124796ca567cce:build:8096370ebda5ceef5ad87ca1afe29f48e79ee974bea891ea985d68261f233757:assembly:vehicle/0:body/2:turret_0/1:gun_0/1:barrel/visual:14","worldBits":[1065353216,0,0,0,0,1065353216,0,0,0,0,1065353216,0,1052938076,1069044203,1069128089,1065353216]}],"meshes":[{"bounds":{"hi":[0.05400000140070915,0.05400000140070915,2.2799999713897705],"lo":[-0.05400000140070915,-0.05400000140070915,0.8500000834465027]},"bvh":null,"key":"mesh:vehicle/0:body/2:turret_0/1:gun_0/1:barrel/visual:14","payloadHash":"a16a299b22a7ffe401719e156ebfbe738c8c9fa4436af0efb6e54c527d28ffc3","positionsHash":"d514cca1fd4a062ecdc172eddcf665960e11490a8a52d31574d98988094536f5","ranges":[{"bindingKey":null,"count":160,"first":0,"solidKey":null,"sourceKey":"generated:c1312a6c9c3623ce9fb78d5530755e1737591678163ea8f401124796ca567cce:build:8096370ebda5ceef5ad87ca1afe29f48e79ee974bea891ea985d68261f233757:assembly:vehicle/0:body/2:turret_0/1:gun_0/1:barrel/visual:14","surfaceKey":"pending:vehicle/0:body/2:turret_0/1:gun_0/1:barrel/visual:14"}],"renderBufferHash":"9bdaffb74fedb4d48e4159b8c3c48ac0615e1bd06d1a081e406cc0161d062a11","triangleCount":160,"vertexCount":480}],"renderGeometryHash":"de8b09b279561f98cc19c8b1e4ee0d84654024955587640e69e8a27ae7905c50","schema":"HitMeshManifestV1","sources":{"assets":[]},"specId":"fixture_selected_hetzer_tube","surfaces":[{"armorLayerKey":null,"contactEligible":null,"crewKey":null,"fuseEligible":null,"key":"pending:vehicle/0:body/2:turret_0/1:gun_0/1:barrel/visual:14","moduleKey":null,"responseRef":null,"role":"audit_pending","topology":"audit_pending","winding":"emitted"}]}